{"axis":{"half_offset_s":180},"charter":{"approved_at":"2026-10-20T09:38:49Z","bundle_sha256":"69282a2fc5b639475627f7bbd0391b781175b422ba16f58e105c898511854485","charter_json_sha256":"9c7de25e513fd31fccec74d29f1a896d262f77cac3643d390c7ecc75382c07c2"},"charter_sha256":"69282a2fc5b639475627f7bbd0391b781175b422ba16f58e105c898511854485","cues":[{"at_s":185,"charter_sha256":"69282a2fc5b639475627f7bbd0391b781175b422ba16f58e105c898511854485","clock":{"label":"4'","ms":185000,"period":1},"club_id":"C6","cue_id":"b23d63ae7cb38ada","data":{},"kind":"player_tag","overlay":"player_tag","player_id":"C6P10","source_event_ids":["2053eaedb10a5255"],"team":"away","template_id":"player_tag","text":{"el":"Liro Ellow, Zennmark Town","en":"Liro Ellow, Zennmark Town","es":"Liro Ellow, Zennmark Town","fr":"Liro Ellow, Zennmark Town"},"until_s":190,"window":{"in_ms":185000,"out_ms":190000}},{"at_s":185,"charter_sha256":"69282a2fc5b639475627f7bbd0391b781175b422ba16f58e105c898511854485","clock":{"label":"4'","ms":185000,"period":1},"club_id":"C6","cue_id":"9c7169151896b4cb","data":{"away_goals":1,"home_goals":0},"kind":"goal","overlay":"lower_third","player_id":"C6P10","source_event_ids":["2053eaedb10a5255"],"team":"away","template_id":"goal","text":{"el":"ΓΚΟΛ 4': Liro Ellow (Zennmark Town). Pellmoor Harriers 0-1 Zennmark Town","en":"GOAL 4': Liro Ellow (Zennmark Town). Pellmoor Harriers 0-1 Zennmark Town","es":"GOL 4': Liro Ellow (Zennmark Town). Pellmoor Harriers 0-1 Zennmark Town","fr":"BUT 4' : Liro Ellow (Zennmark Town). Pellmoor Harriers 0-1 Zennmark Town"},"until_s":195,"window":{"in_ms":185000,"out_ms":195000}},{"at_s":1696,"charter_sha256":"69282a2fc5b639475627f7bbd0391b781175b422ba16f58e105c898511854485","clock":{"label":"29'","ms":1696000,"period":1},"club_id":"C6","cue_id":"2421ca6b60496348","data":{},"kind":"player_tag","overlay":"player_tag","player_id":"C6P17","source_event_ids":["cb1672eb252b1f75"],"team":"away","template_id":"player_tag","text":{"el":"Vane Quenby, Zennmark Town","en":"Vane Quenby, Zennmark Town","es":"Vane Quenby, Zennmark Town","fr":"Vane Quenby, Zennmark Town"},"until_s":1701,"window":{"in_ms":1696000,"out_ms":1701000}},{"at_s":1696,"charter_sha256":"69282a2fc5b639475627f7bbd0391b781175b422ba16f58e105c898511854485","clock":{"label":"29'","ms":1696000,"period":1},"club_id":"C6","cue_id":"5a3435abc1e14766","data":{"difficulty":52,"distance_m":32},"kind":"pass_quality","overlay":"stat_card","player_id":"C6P17","source_event_ids":["cb1672eb252b1f75"],"team":"away","template_id":"pass_quality","text":{"el":"Vane Quenby (Zennmark Town): πάσα 32 μέτρων, δυσκολία 52 στα 100.","en":"Vane Quenby (Zennmark Town): 32 m pass, difficulty 52 of 100.","es":"Vane Quenby (Zennmark Town): pase de 32 m, dificultad 52 sobre 100.","fr":"Vane Quenby (Zennmark Town) : passe de 32 m, difficulté 52 sur 100."},"until_s":1703,"window":{"in_ms":1696000,"out_ms":1703000}},{"at_s":2807,"charter_sha256":"69282a2fc5b639475627f7bbd0391b781175b422ba16f58e105c898511854485","clock":{"label":"45+2'","ms":2807000,"period":1},"club_id":"C1","cue_id":"e8f2a5960bf7c3fe","data":{},"kind":"player_tag","overlay":"player_tag","player_id":"C1P09","source_event_ids":["efcab03343406b46"],"team":"home","template_id":"player_tag","text":{"el":"Sten Jendale, Pellmoor Harriers","en":"Sten Jendale, Pellmoor Harriers","es":"Sten Jendale, Pellmoor Harriers","fr":"Sten Jendale, Pellmoor Harriers"},"until_s":2812,"window":{"in_ms":2807000,"out_ms":2812000}},{"at_s":2807,"charter_sha256":"69282a2fc5b639475627f7bbd0391b781175b422ba16f58e105c898511854485","clock":{"label":"45+2'","ms":2807000,"period":1},"club_id":"C1","cue_id":"240abc130738a1db","data":{"difficulty":60,"distance_m":45},"kind":"pass_quality","overlay":"stat_card","player_id":"C1P09","source_event_ids":["efcab03343406b46"],"team":"home","template_id":"pass_quality","text":{"el":"Sten Jendale (Pellmoor Harriers): πάσα 45 μέτρων, δυσκολία 60 στα 100.","en":"Sten Jendale (Pellmoor Harriers): 45 m pass, difficulty 60 of 100.","es":"Sten Jendale (Pellmoor Harriers): pase de 45 m, dificultad 60 sobre 100.","fr":"Sten Jendale (Pellmoor Harriers) : passe de 45 m, difficulté 60 sur 100."},"until_s":2814,"window":{"in_ms":2807000,"out_ms":2814000}},{"at_s":3482,"charter_sha256":"69282a2fc5b639475627f7bbd0391b781175b422ba16f58e105c898511854485","clock":{"label":"56'","ms":3302000,"period":2},"club_id":"C6","cue_id":"6dcfb250619168c3","data":{},"kind":"player_tag","overlay":"player_tag","player_id":"C6P05","source_event_ids":["96f766bb05cb0cfe"],"team":"away","template_id":"player_tag","text":{"el":"Oren Selow, Zennmark Town","en":"Oren Selow, Zennmark Town","es":"Oren Selow, Zennmark Town","fr":"Oren Selow, Zennmark Town"},"until_s":3487,"window":{"in_ms":3302000,"out_ms":3307000}},{"at_s":3482,"charter_sha256":"69282a2fc5b639475627f7bbd0391b781175b422ba16f58e105c898511854485","clock":{"label":"56'","ms":3302000,"period":2},"club_id":"C6","cue_id":"3bbc344fe94f2fa7","data":{},"kind":"substitution","overlay":"lower_third","player_id":"C6P05","source_event_ids":["96f766bb05cb0cfe"],"team":"away","template_id":"substitution","text":{"el":"Αλλαγή 56', Zennmark Town: μπαίνει Oren Selow, βγαίνει Rafe Orridge.","en":"Substitution 56', Zennmark Town: Oren Selow on, Rafe Orridge off.","es":"Cambio 56', Zennmark Town: entra Oren Selow, sale Rafe Orridge.","fr":"Remplacement 56', Zennmark Town : entrée de Oren Selow, sortie de Rafe Orridge."},"until_s":3490,"window":{"in_ms":3302000,"out_ms":3310000}},{"at_s":3726,"charter_sha256":"69282a2fc5b639475627f7bbd0391b781175b422ba16f58e105c898511854485","clock":{"label":"60'","ms":3546000,"period":2},"club_id":"C1","cue_id":"835e8b1990f041f1","data":{},"kind":"player_tag","overlay":"player_tag","player_id":"C1P10","source_event_ids":["59a0c62894a732e9"],"team":"home","template_id":"player_tag","text":{"el":"Esko Jenton, Pellmoor Harriers","en":"Esko Jenton, Pellmoor Harriers","es":"Esko Jenton, Pellmoor Harriers","fr":"Esko Jenton, Pellmoor Harriers"},"until_s":3731,"window":{"in_ms":3546000,"out_ms":3551000}},{"at_s":3726,"charter_sha256":"69282a2fc5b639475627f7bbd0391b781175b422ba16f58e105c898511854485","clock":{"label":"60'","ms":3546000,"period":2},"club_id":"C1","cue_id":"bc7e33ed5485beda","data":{},"kind":"substitution","overlay":"lower_third","player_id":"C1P10","source_event_ids":["59a0c62894a732e9"],"team":"home","template_id":"substitution","text":{"el":"Αλλαγή 60', Pellmoor Harriers: μπαίνει Esko Jenton, βγαίνει Deln Orrton.","en":"Substitution 60', Pellmoor Harriers: Esko Jenton on, Deln Orrton off.","es":"Cambio 60', Pellmoor Harriers: entra Esko Jenton, sale Deln Orrton.","fr":"Remplacement 60', Pellmoor Harriers : entrée de Esko Jenton, sortie de Deln Orrton."},"until_s":3734,"window":{"in_ms":3546000,"out_ms":3554000}},{"at_s":3904,"charter_sha256":"69282a2fc5b639475627f7bbd0391b781175b422ba16f58e105c898511854485","clock":{"label":"63'","ms":3724000,"period":2},"club_id":"C6","cue_id":"6e909f93e8c791e0","data":{},"kind":"player_tag","overlay":"player_tag","player_id":"C6P15","source_event_ids":["5eb44e45e15301be"],"team":"away","template_id":"player_tag","text":{"el":"Joss Garford, Zennmark Town","en":"Joss Garford, Zennmark Town","es":"Joss Garford, Zennmark Town","fr":"Joss Garford, Zennmark Town"},"until_s":3909,"window":{"in_ms":3724000,"out_ms":3729000}},{"at_s":3904,"charter_sha256":"69282a2fc5b639475627f7bbd0391b781175b422ba16f58e105c898511854485","clock":{"label":"63'","ms":3724000,"period":2},"club_id":"C6","cue_id":"356e8edc398afd3b","data":{},"kind":"substitution","overlay":"lower_third","player_id":"C6P15","source_event_ids":["5eb44e45e15301be"],"team":"away","template_id":"substitution","text":{"el":"Αλλαγή 63', Zennmark Town: μπαίνει Joss Garford, βγαίνει Kit Ulmwood.","en":"Substitution 63', Zennmark Town: Joss Garford on, Kit Ulmwood off.","es":"Cambio 63', Zennmark Town: entra Joss Garford, sale Kit Ulmwood.","fr":"Remplacement 63', Zennmark Town : entrée de Joss Garford, sortie de Kit Ulmwood."},"until_s":3912,"window":{"in_ms":3724000,"out_ms":3732000}},{"at_s":4139,"charter_sha256":"69282a2fc5b639475627f7bbd0391b781175b422ba16f58e105c898511854485","clock":{"label":"66'","ms":3959000,"period":2},"club_id":"C6","cue_id":"f1fb351817fa860e","data":{},"kind":"player_tag","overlay":"player_tag","player_id":"C6P11","source_event_ids":["080377087d134fbb"],"team":"away","template_id":"player_tag","text":{"el":"Sten Lorgrave, Zennmark Town","en":"Sten Lorgrave, Zennmark Town","es":"Sten Lorgrave, Zennmark Town","fr":"Sten Lorgrave, Zennmark Town"},"until_s":4144,"window":{"in_ms":3959000,"out_ms":3964000}},{"at_s":4139,"charter_sha256":"69282a2fc5b639475627f7bbd0391b781175b422ba16f58e105c898511854485","clock":{"label":"66'","ms":3959000,"period":2},"club_id":"C6","cue_id":"cbe5fe8d9bc4dbb1","data":{"difficulty":55,"distance_m":39},"kind":"pass_quality","overlay":"stat_card","player_id":"C6P11","source_event_ids":["080377087d134fbb"],"team":"away","template_id":"pass_quality","text":{"el":"Sten Lorgrave (Zennmark Town): πάσα 39 μέτρων, δυσκολία 55 στα 100.","en":"Sten Lorgrave (Zennmark Town): 39 m pass, difficulty 55 of 100.","es":"Sten Lorgrave (Zennmark Town): pase de 39 m, dificultad 55 sobre 100.","fr":"Sten Lorgrave (Zennmark Town) : passe de 39 m, difficulté 55 sur 100."},"until_s":4146,"window":{"in_ms":3959000,"out_ms":3966000}},{"at_s":4479,"charter_sha256":"69282a2fc5b639475627f7bbd0391b781175b422ba16f58e105c898511854485","clock":{"label":"72'","ms":4299000,"period":2},"club_id":"C1","cue_id":"7c3e1778b1ce4dbf","data":{},"kind":"player_tag","overlay":"player_tag","player_id":"C1P03","source_event_ids":["c3bac3045eb1f127"],"team":"home","template_id":"player_tag","text":{"el":"Zev Wexwell, Pellmoor Harriers","en":"Zev Wexwell, Pellmoor Harriers","es":"Zev Wexwell, Pellmoor Harriers","fr":"Zev Wexwell, Pellmoor Harriers"},"until_s":4484,"window":{"in_ms":4299000,"out_ms":4304000}},{"at_s":4479,"charter_sha256":"69282a2fc5b639475627f7bbd0